{
  "schema": "psi_reconstruction/1",
  "generated_by": "8672b2d",
  "params": {"x_min": 2, "x_max": 30, "n_x": 400, "n_zeros_available": 269, "note": "series converges to midpoint-normalized psi_0"},
  "x": [2,2.0701754386,2.14035087719,2.21052631579,2.28070175439,2.35087719298,2.42105263158,2.49122807018,2.56140350877,2.63157894737,2.70175438596,2.77192982456,2.84210526316,2.91228070175,2.98245614035,3.05263157895,3.12280701754,3.19298245614,3.26315789474,3.33333333333,3.40350877193,3.47368421053,3.54385964912,3.61403508772,3.68421052632,3.75438596491,3.82456140351,3.89473684211,3.9649122807,4.0350877193,4.10526315789,4.17543859649,4.24561403509,4.31578947368,4.38596491228,4.45614035088,4.52631578947,4.59649122807,4.66666666667,4.73684210526,4.80701754386,4.87719298246,4.94736842105,5.01754385965,5.08771929825,5.15789473684,5.22807017544,5.29824561404,5.36842105263,5.43859649123,5.50877192982,5.57894736842,5.64912280702,5.71929824561,5.78947368421,5.85964912281,5.9298245614,6,6.0701754386,6.14035087719,6.21052631579,6.28070175439,6.35087719298,6.42105263158,6.49122807018,6.56140350877,6.63157894737,6.70175438596,6.77192982456,6.84210526316,6.91228070175,6.98245614035,7.05263157895,7.12280701754,7.19298245614,7.26315789474,7.33333333333,7.40350877193,7.47368421053,7.54385964912,7.61403508772,7.68421052632,7.75438596491,7.82456140351,7.89473684211,7.9649122807,8.0350877193,8.10526315789,8.17543859649,8.24561403509,8.31578947368,8.38596491228,8.45614035088,8.52631578947,8.59649122807,8.66666666667,8.73684210526,8.80701754386,8.87719298246,8.94736842105,9.01754385965,9.08771929825,9.15789473684,9.22807017544,9.29824561404,9.36842105263,9.43859649123,9.50877192982,9.57894736842,9.64912280702,9.71929824561,9.78947368421,9.85964912281,9.9298245614,10,10.0701754386,10.1403508772,10.2105263158,10.2807017544,10.350877193,10.4210526316,10.4912280702,10.5614035088,10.6315789474,10.701754386,10.7719298246,10.8421052632,10.9122807018,10.9824561404,11.0526315789,11.1228070175,11.1929824561,11.2631578947,11.3333333333,11.4035087719,11.4736842105,11.5438596491,11.6140350877,11.6842105263,11.7543859649,11.8245614035,11.8947368421,11.9649122807,12.0350877193,12.1052631579,12.1754385965,12.2456140351,12.3157894737,12.3859649123,12.4561403509,12.5263157895,12.5964912281,12.6666666667,12.7368421053,12.8070175439,12.8771929825,12.9473684211,13.0175438596,13.0877192982,13.1578947368,13.2280701754,13.298245614,13.3684210526,13.4385964912,13.5087719298,13.5789473684,13.649122807,13.7192982456,13.7894736842,13.8596491228,13.9298245614,14,14.0701754386,14.1403508772,14.2105263158,14.2807017544,14.350877193,14.4210526316,14.4912280702,14.5614035088,14.6315789474,14.701754386,14.7719298246,14.8421052632,14.9122807018,14.9824561404,15.0526315789,15.1228070175,15.1929824561,15.2631578947,15.3333333333,15.4035087719,15.4736842105,15.5438596491,15.6140350877,15.6842105263,15.7543859649,15.8245614035,15.8947368421,15.9649122807,16.0350877193,16.1052631579,16.1754385965,16.2456140351,16.3157894737,16.3859649123,16.4561403509,16.5263157895,16.5964912281,16.6666666667,16.7368421053,16.8070175439,16.8771929825,16.9473684211,17.0175438596,17.0877192982,17.1578947368,17.2280701754,17.298245614,17.3684210526,17.4385964912,17.5087719298,17.5789473684,17.649122807,17.7192982456,17.7894736842,17.8596491228,17.9298245614,18,18.0701754386,18.1403508772,18.2105263158,18.2807017544,18.350877193,18.4210526316,18.4912280702,18.5614035088,18.6315789474,18.701754386,18.7719298246,18.8421052632,18.9122807018,18.9824561404,19.0526315789,19.1228070175,19.1929824561,19.2631578947,19.3333333333,19.4035087719,19.4736842105,19.5438596491,19.6140350877,19.6842105263,19.7543859649,19.8245614035,19.8947368421,19.9649122807,20.0350877193,20.1052631579,20.1754385965,20.2456140351,20.3157894737,20.3859649123,20.4561403509,20.5263157895,20.5964912281,20.6666666667,20.7368421053,20.8070175439,20.8771929825,20.9473684211,21.0175438596,21.0877192982,21.1578947368,21.2280701754,21.298245614,21.3684210526,21.4385964912,21.5087719298,21.5789473684,21.649122807,21.7192982456,21.7894736842,21.8596491228,21.9298245614,22,22.0701754386,22.1403508772,22.2105263158,22.2807017544,22.350877193,22.4210526316,22.4912280702,22.5614035088,22.6315789474,22.701754386,22.7719298246,22.8421052632,22.9122807018,22.9824561404,23.0526315789,23.1228070175,23.1929824561,23.2631578947,23.3333333333,23.4035087719,23.4736842105,23.5438596491,23.6140350877,23.6842105263,23.7543859649,23.8245614035,23.8947368421,23.9649122807,24.0350877193,24.1052631579,24.1754385965,24.2456140351,24.3157894737,24.3859649123,24.4561403509,24.5263157895,24.5964912281,24.6666666667,24.7368421053,24.8070175439,24.8771929825,24.9473684211,25.0175438596,25.0877192982,25.1578947368,25.2280701754,25.298245614,25.3684210526,25.4385964912,25.5087719298,25.5789473684,25.649122807,25.7192982456,25.7894736842,25.8596491228,25.9298245614,26,26.0701754386,26.1403508772,26.2105263158,26.2807017544,26.350877193,26.4210526316,26.4912280702,26.5614035088,26.6315789474,26.701754386,26.7719298246,26.8421052632,26.9122807018,26.9824561404,27.0526315789,27.1228070175,27.1929824561,27.2631578947,27.3333333333,27.4035087719,27.4736842105,27.5438596491,27.6140350877,27.6842105263,27.7543859649,27.8245614035,27.8947368421,27.9649122807,28.0350877193,28.1052631579,28.1754385965,28.2456140351,28.3157894737,28.3859649123,28.4561403509,28.5263157895,28.5964912281,28.6666666667,28.7368421053,28.8070175439,28.8771929825,28.9473684211,29.0175438596,29.0877192982,29.1578947368,29.2280701754,29.298245614,29.3684210526,29.4385964912,29.5087719298,29.5789473684,29.649122807,29.7192982456,29.7894736842,29.8596491228,29.9298245614,30],